{
  "schemaVersion": 2,
  "id": "hdip-computing-2026",
  "title": "Higher Diploma in Science in Computing",
  "awardType": "Higher Diploma",
  "awardTypeIsOther": false,
  "nfqLevel": 8,
  "school": "Computing",
  "awardStandardIds": ["qqi-computing-l6-9"],
  "awardStandardNames": ["QQI Computing Awards Standards (Levels 6â€“9)"],
  "totalCredits": 60,
  "mode": "MODULE_EDITOR",
  "moduleEditor": {
    "assignedModuleIds": ["mod_sd", "mod_db", "mod_web"],
    "locks": {
      "programme": true,
      "modulesMeta": true,
      "versions": true,
      "plos": true
    }
  },
  "updatedAt": "2026-01-16T23:38:20.134Z",
  "modules": [
    {
      "id": "mod_sd",
      "code": "CMP8001",
      "title": "Software Development",
      "credits": 10,
      "effortHours": {
        "ver_ft_F2F": {
          "classroomHours": 48,
          "classroomRatio": "1:60",
          "mentoringHours": 12,
          "mentoringRatio": "1:25",
          "otherContactHours": 0,
          "directedElearningHours": 40,
          "independentLearningHours": 140,
          "workBasedHours": 0,
          "otherHours": 10,
          "otherHoursSpecify": "Lab setup"
        },
        "ver_pt_blended_BLENDED": {
          "classroomHours": 24,
          "classroomRatio": "1:40",
          "mentoringHours": 12,
          "mentoringRatio": "1:20",
          "otherContactHours": 0,
          "directedElearningHours": 80,
          "independentLearningHours": 124,
          "workBasedHours": 0,
          "otherHours": 10,
          "otherHoursSpecify": "Lab setup"
        },
        "ver_pt_online_ONLINE": {
          "classroomHours": 0,
          "classroomRatio": "",
          "mentoringHours": 24,
          "mentoringRatio": "1:20",
          "otherContactHours": 12,
          "otherContactRatio": "1:30",
          "otherContactSpecify": "Live coding sessions",
          "directedElearningHours": 100,
          "independentLearningHours": 114,
          "workBasedHours": 0,
          "otherHours": 0
        }
      },
      "mimlos": [
        {
          "id": "mimlo_sd_1",
          "text": "Design and implement object-oriented software solutions using industry-standard programming languages"
        },
        {
          "id": "mimlo_sd_2",
          "text": "Apply software development methodologies to manage the software development lifecycle"
        },
        {
          "id": "mimlo_sd_3",
          "text": "Evaluate and select appropriate data structures and algorithms for specific problem domains"
        },
        {
          "id": "mimlo_sd_4",
          "text": "Demonstrate proficiency in version control and collaborative development practices"
        }
      ],
      "assessments": [
        {
          "id": "asm_sd_1",
          "title": "Programming Project",
          "type": "Project",
          "weighting": 50,
          "mode": "Hybrid",
          "integrity": {
            "originalityCheck": true,
            "aiDeclaration": true,
            "viva": true
          },
          "mimloIds": ["mimlo_sd_1", "mimlo_sd_2", "mimlo_sd_4"],
          "notes": "Individual software development project with viva presentation"
        },
        {
          "id": "asm_sd_2",
          "title": "Technical Report",
          "type": "Report/Essay",
          "weighting": 20,
          "mode": "Online",
          "integrity": {
            "originalityCheck": true,
            "aiDeclaration": true
          },
          "mimloIds": ["mimlo_sd_2", "mimlo_sd_3"],
          "notes": "Analysis of software development approaches"
        },
        {
          "id": "asm_sd_3",
          "title": "Practical Lab Exercises",
          "type": "Practical/Lab",
          "weighting": 30,
          "mode": "Hybrid",
          "integrity": {
            "inClass": true
          },
          "mimloIds": ["mimlo_sd_1", "mimlo_sd_3", "mimlo_sd_4"],
          "notes": "Weekly lab submissions"
        }
      ],
      "readingList": [
        {
          "type": "Core",
          "title": "Clean Code: A Handbook of Agile Software Craftsmanship",
          "author": "Robert C. Martin",
          "publisher": "Pearson",
          "year": "2023",
          "isbn": "978-0132350884"
        }
      ]
    },
    {
      "id": "mod_oop",
      "code": "CMP8002",
      "title": "Object Oriented Software Engineering",
      "credits": 10,
      "effortHours": {
        "ver_ft_F2F": {
          "classroomHours": 48,
          "classroomRatio": "1:60",
          "mentoringHours": 12,
          "mentoringRatio": "1:25",
          "directedElearningHours": 40,
          "independentLearningHours": 150,
          "workBasedHours": 0,
          "otherHours": 0
        },
        "ver_pt_blended_BLENDED": {
          "classroomHours": 24,
          "classroomRatio": "1:40",
          "mentoringHours": 12,
          "mentoringRatio": "1:20",
          "directedElearningHours": 80,
          "independentLearningHours": 134,
          "workBasedHours": 0,
          "otherHours": 0
        },
        "ver_pt_online_ONLINE": {
          "classroomHours": 0,
          "mentoringHours": 24,
          "mentoringRatio": "1:20",
          "otherContactHours": 12,
          "otherContactRatio": "1:30",
          "otherContactSpecify": "Design workshops",
          "directedElearningHours": 100,
          "independentLearningHours": 114,
          "workBasedHours": 0
        }
      },
      "mimlos": [
        {
          "id": "mimlo_oop_1",
          "text": "Apply object-oriented design principles and patterns to software architecture"
        },
        {
          "id": "mimlo_oop_2",
          "text": "Analyse requirements and create UML models for complex software systems"
        },
        {
          "id": "mimlo_oop_3",
          "text": "Implement and test software using test-driven development practices"
        },
        {
          "id": "mimlo_oop_4",
          "text": "Evaluate software quality using appropriate metrics and refactoring techniques"
        }
      ],
      "assessments": [
        {
          "id": "asm_oop_1",
          "title": "Design Project",
          "type": "Project",
          "weighting": 60,
          "mode": "Hybrid",
          "integrity": {
            "originalityCheck": true,
            "aiDeclaration": true,
            "viva": true
          },
          "mimloIds": ["mimlo_oop_1", "mimlo_oop_2", "mimlo_oop_3"],
          "notes": "Group project with individual viva"
        },
        {
          "id": "asm_oop_2",
          "title": "Continuous Assessment",
          "type": "Portfolio",
          "weighting": 40,
          "mode": "Online",
          "integrity": {
            "originalityCheck": true
          },
          "mimloIds": ["mimlo_oop_2", "mimlo_oop_4"],
          "notes": "Weekly design exercises and reflections"
        }
      ],
      "readingList": [
        {
          "id": "reading_a606f8bd-67d6-43c1-ac14-6c9e4f8827e3",
          "author": "Robert C. Martin",
          "title": "Clean Code",
          "publisher": "Prentice Hall",
          "year": "2008",
          "isbn": "978-0132350884",
          "type": "core",
          "notes": ""
        }
      ]
    },
    {
      "id": "mod_db",
      "code": "CMP8003",
      "title": "Introduction to Databases",
      "credits": 5,
      "effortHours": {
        "ver_ft_F2F": {
          "classroomHours": 24,
          "classroomRatio": "1:60",
          "mentoringHours": 6,
          "mentoringRatio": "1:25",
          "directedElearningHours": 20,
          "independentLearningHours": 75,
          "workBasedHours": 0,
          "otherHours": 0
        },
        "ver_pt_blended_BLENDED": {
          "classroomHours": 12,
          "classroomRatio": "1:40",
          "mentoringHours": 6,
          "mentoringRatio": "1:20",
          "directedElearningHours": 40,
          "independentLearningHours": 67,
          "workBasedHours": 0,
          "otherHours": 0
        },
        "ver_pt_online_ONLINE": {
          "classroomHours": 0,
          "mentoringHours": 12,
          "mentoringRatio": "1:20",
          "otherContactHours": 6,
          "otherContactSpecify": "SQL workshops",
          "directedElearningHours": 50,
          "independentLearningHours": 57,
          "workBasedHours": 0
        }
      },
      "mimlos": [
        {
          "id": "mimlo_db_1",
          "text": "Design normalised relational database schemas using entity-relationship modelling"
        },
        {
          "id": "mimlo_db_2",
          "text": "Implement and query databases using SQL"
        },
        {
          "id": "mimlo_db_3",
          "text": "Evaluate database performance and apply indexing strategies"
        }
      ],
      "assessments": [
        {
          "id": "asm_db_1",
          "title": "Database Design Project",
          "type": "Project",
          "weighting": 40,
          "mode": "Hybrid",
          "integrity": {
            "originalityCheck": true,
            "aiDeclaration": true
          },
          "mimloIds": ["mimlo_db_1", "mimlo_db_2"],
          "notes": "Design and implement a database for a given scenario"
        },
        {
          "id": "asm_db_2",
          "title": "Final Examination",
          "type": "Exam (On campus)",
          "weighting": 60,
          "mode": "OnCampus",
          "integrity": {
            "proctored": true
          },
          "mimloIds": ["mimlo_db_1", "mimlo_db_2", "mimlo_db_3"],
          "notes": "2-hour written exam"
        }
      ],
      "readingList": [
        {
          "id": "reading_8c0bca2f-fd67-41f7-98ac-4bff7d478cf5",
          "author": "Robert C. Martin",
          "title": "Clean Code",
          "publisher": "Prentice Hall",
          "year": "2008",
          "isbn": "978-0132350884",
          "type": "core",
          "notes": ""
        }
      ]
    },
    {
      "id": "mod_web",
      "code": "CMP8004",